title,content,excerpt,category,author,image,date
"The Ultimate Guide to Building Muscle Mass","Building muscle mass requires a combination of proper training, nutrition, and recovery. In this comprehensive guide, we'll explore the science behind muscle growth and provide you with practical strategies to maximize your gains. First, let's understand the basics of muscle hypertrophy. When you lift weights, you create microscopic tears in your muscle fibers. During recovery, your body repairs these tears, making the muscles stronger and larger. This process is called muscle protein synthesis. To optimize muscle growth, you need to focus on progressive overload, which means gradually increasing the weight, reps, or intensity of your workouts over time. Aim for 3-4 strength training sessions per week, targeting all major muscle groups. Compound exercises like squats, deadlifts, bench press, and rows should form the foundation of your program. For nutrition, protein is crucial. Aim for 0.7-1 gram of protein per pound of body weight daily. Good sources include lean meats, fish, eggs, dairy, and plant-based options like beans and tofu. Don't forget about carbohydrates and healthy fats, which provide energy for your workouts and support hormone production. Recovery is equally important. Aim for 7-9 hours of quality sleep per night, as this is when most muscle repair and growth occurs. Stay hydrated, manage stress, and consider incorporating stretching or yoga into your routine. Remember, building muscle is a marathon, not a sprint. Be patient, stay consistent, and the results will come.","Learn the science-backed strategies for building muscle mass effectively, including training, nutrition, and recovery tips.","fitness","Mike Johnson","https://images.pexels.com/photos/1547248/pexels-photo-1547248.jpeg","2024-01-15"
"10 Healthy Breakfast Recipes for Weight Loss","Starting your day with a nutritious breakfast can set the tone for healthy eating throughout the day. Here are 10 delicious and weight-loss-friendly breakfast recipes that will keep you satisfied until lunch. 1. Greek Yogurt Parfait: Layer Greek yogurt with berries, a drizzle of honey, and a sprinkle of granola for a protein-packed start. 2. Overnight Oats: Combine oats, milk, chia seeds, and your favorite toppings. Prepare the night before for a quick morning meal. 3. Veggie Omelet: Whisk eggs with spinach, tomatoes, peppers, and a sprinkle of cheese for a low-carb option. 4. Avocado Toast: Top whole grain bread with mashed avocado, a poached egg, and everything bagel seasoning. 5. Smoothie Bowl: Blend frozen fruits with Greek yogurt, then top with nuts, seeds, and fresh fruit. 6. Quinoa Breakfast Bowl: Cook quinoa in almond milk and top with berries, nuts, and a dash of cinnamon. 7. Cottage Cheese Pancakes: Mix cottage cheese, eggs, and oats for high-protein pancakes. 8. Chia Pudding: Soak chia seeds in milk overnight and top with fresh fruit in the morning. 9. Breakfast Burrito: Wrap scrambled eggs, black beans, salsa, and avocado in a whole wheat tortilla. 10. Apple Cinnamon Oatmeal: Cook steel-cut oats with diced apples and cinnamon for a comforting meal. Each of these recipes provides essential nutrients while keeping calories in check, perfect for your weight loss journey.","Discover 10 nutritious and delicious breakfast recipes that support your weight loss goals while keeping you satisfied.","nutrition","Sarah Williams","https://images.pexels.com/photos/1640777/pexels-photo-1640777.jpeg","2024-01-16"
"The Best Men's Style Trends for 2024","Fashion evolves constantly, and 2024 brings exciting new trends for the modern man. Here's your guide to staying stylish this year. First up, oversized blazers are making a comeback. Pair them with fitted trousers for a balanced silhouette. The key is to ensure the shoulders fit properly while allowing for a roomier body. Earth tones continue to dominate, with olive green, rust, and camel being particularly popular. These versatile colors work well for both casual and formal occasions. Vintage-inspired pieces are huge this year. Think retro sneakers, classic denim jackets, and throwback athletic wear. Mix these with modern pieces to avoid looking costume-y. Textured fabrics add visual interest to any outfit. Look for corduroy pants, cable knit sweaters, and tweed jackets. These pieces add depth to your wardrobe and work across seasons. Accessories are becoming bolder. Statement watches, chunky chains, and designer belts are all having a moment. Don't be afraid to invest in one standout piece. Sustainable fashion is no longer just a trend—it's a movement. Look for brands using eco-friendly materials and ethical production methods. Your style choices can make a positive impact. Finally, comfort remains king. The athleisure trend evolves with more sophisticated pieces that blur the line between sportswear and everyday clothing. Remember, the best trend is confidence. Wear what makes you feel good and adapt trends to your personal style.","Stay ahead of the fashion curve with these essential men's style trends for 2024, from oversized blazers to sustainable fashion.","style","David Chen","https://images.pexels.com/photos/1043474/pexels-photo-1043474.jpeg","2024-01-17"
"Top 10 Protein-Rich Foods for Men","Why Protein Matters: Protein is essential for muscle repair, growth, and overall health. Men typically need 1.6-2.2 grams of protein per kilogram of body weight daily. Best Protein Sources: 1. Lean chicken breast - 31g protein per 100g serving. 2. Wild-caught salmon - 25g protein per 100g serving. 3. Greek yogurt - 10g protein per 100g serving. 4. Eggs - 13g protein per 100g serving. 5. Quinoa - 4.4g protein per 100g serving. 6. Lentils - 9g protein per 100g serving. 7. Almonds - 21g protein per 100g serving. 8. Cottage cheese - 11g protein per 100g serving. 9. Tuna - 30g protein per 100g serving. 10. Lean beef - 26g protein per 100g serving. Incorporating these foods into your daily diet will help you meet your protein goals and support your fitness objectives. Remember to combine protein sources throughout the day for optimal absorption and muscle synthesis.","Discover the top 10 protein-rich foods that should be staples in every man's diet for optimal health and muscle building.","nutrition","Sarah Mitchell","https://images.pexels.com/photos/1640770/pexels-photo-1640770.jpeg","2024-01-14"
"Mental Health Tips for Modern Men","Breaking the Stigma: Mental health is just as important as physical health, yet many men struggle to address their emotional well-being due to societal expectations. It's time to change this narrative and prioritize mental wellness. Practical Strategies: Here are evidence-based approaches to improve your mental health: 1. Practice mindfulness and meditation - Even 10 minutes daily can reduce stress and improve focus. 2. Maintain social connections - Regular interaction with friends and family is crucial for emotional support. 3. Exercise regularly - Physical activity releases endorphins and improves mood. 4. Get adequate sleep - Aim for 7-9 hours of quality sleep each night. 5. Seek professional help when needed - Therapy is a sign of strength, not weakness. Building Resilience: Developing emotional resilience takes time and practice. Start with small steps like journaling your thoughts, practicing gratitude, or learning stress management techniques. Remember that setbacks are normal and part of the growth process. Be patient with yourself as you build these important life skills. Your mental health journey is unique, and there's no shame in taking the time you need to heal and grow.","Essential mental health strategies for men to build resilience, manage stress, and maintain emotional well-being in today's challenging world.","health","Dr. James Wilson","https://images.pexels.com/photos/4386467/pexels-photo-4386467.jpeg","2024-01-13" 